{
  "gate": "CV-TXCTX",
  "spec": "SPEC-TXCTX-01 v2.0",
  "version": "1.0.0",
  "profiles": {
    "test_amm_profile": {
      "ext_id": 4095,
      "ext_id_hex": "0fff",
      "suite_id": 16,
      "suite_id_hex": "10",
      "txcontext_enabled": 1,
      "allowed_sighash_set": 1,
      "max_ext_payload_bytes": 48,
      "binding_kind": 2,
      "suite_count": 1,
      "activation_height": 100,
      "verifier_logic": "requires ContinuingOutputCount>=1; checks new_reserve_x*new_reserve_y >= old_reserve_x*old_reserve_y; old reserves from e.ext_payload[0..16], new from ContinuingOutputs[0].ExtPayload[0..16]",
      "baseline": {
        "old_reserve_x": 100,
        "old_reserve_y": 200,
        "old_product": 20000
      },
      "abi": "9-param"
    },
    "test_passthrough_profile": {
      "ext_id": 4094,
      "ext_id_hex": "0ffe",
      "suite_id": 16,
      "suite_id_hex": "10",
      "txcontext_enabled": 1,
      "allowed_sighash_set": 1,
      "max_ext_payload_bytes": 48,
      "binding_kind": 2,
      "suite_count": 1,
      "activation_height": 100,
      "verifier_logic": "always returns true",
      "abi": "9-param"
    },
    "test_disabled_profile": {
      "ext_id": 4093,
      "ext_id_hex": "0ffd",
      "suite_id": 16,
      "suite_id_hex": "10",
      "txcontext_enabled": 0,
      "allowed_sighash_set": 0,
      "max_ext_payload_bytes": 0,
      "binding_kind": 2,
      "suite_count": 1,
      "activation_height": 100,
      "verifier_logic": "always returns true regardless of sig content (test context only); 6-parameter ABI — no TxContext params (no ctx_base, ctx_continuing, self_input_value). [M2 FIX: was \"always returns true for valid ML-DSA-87 sig\" — that description implied sig validation which this test fixture does NOT perform. Harness MUST dispatch using 6-param ABI based on txcontext_enabled=0x00, not on verifier_logic text.]",
      "abi": "6-param"
    },
    "test_acp_profile": {
      "ext_id": 4092,
      "ext_id_hex": "0ffc",
      "suite_id": 16,
      "suite_id_hex": "10",
      "txcontext_enabled": 1,
      "allowed_sighash_set": 129,
      "max_ext_payload_bytes": 48,
      "binding_kind": 2,
      "suite_count": 1,
      "activation_height": 100,
      "verifier_logic": "always returns true",
      "abi": "9-param"
    }
  },
  "vectors": [
    {
      "id": "CV-TXCTX-01",
      "description": "K=2 continuing outputs, AMM invariant satisfied",
      "profile": "test_amm_profile",
      "height": 200,
      "sighash_type": 1,
      "self_input_value": 1000,
      "ext_payload_hex": "6400000000000000c800000000000000",
      "note": "old_reserve_x=100 (u64le), old_reserve_y=200 (u64le) AMM verifier reads new reserves ONLY from ContinuingOutputs[0].ExtPayload[0:16]. ContinuingOutputs[1] (if present) is NOT read by the AMM invariant check — it is present as a second output (e.g., LP token) but ignored by this verifier. Implementations MUST NOT aggregate or sum reserves across multiple ContinuingOutputs.",
      "continuing_outputs": [
        {
          "value": 950,
          "ext_payload_hex": "6b00000000000000cf00000000000000",
          "note": "new_reserve_x=107, new_reserve_y=207; 107*207=22149 >= 20000"
        },
        {
          "value": 50,
          "ext_payload_hex": "3200000000000000c800000000000000",
          "note": "LP token output, ext_id=0x0FFF same profile"
        }
      ],
      "expect_ok": true
    },
    {
      "id": "CV-TXCTX-02",
      "description": "0 continuing outputs; test_amm_profile requires Count>=1",
      "profile": "test_amm_profile",
      "height": 200,
      "sighash_type": 1,
      "self_input_value": 1000,
      "ext_payload_hex": "6400000000000000c800000000000000",
      "continuing_outputs": [],
      "expect_ok": false,
      "expect_err": "TX_ERR_SIG_INVALID",
      "note": "verifier returns false: ContinuingOutputCount=0 < required 1"
    },
    {
      "id": "CV-TXCTX-03",
      "description": "0 continuing outputs; test_passthrough_profile always accepts",
      "profile": "test_passthrough_profile",
      "height": 200,
      "sighash_type": 1,
      "self_input_value": 500,
      "ext_payload_hex": "00",
      "continuing_outputs": [],
      "expect_ok": true
    },
    {
      "id": "CV-TXCTX-04",
      "description": "5 continuing outputs same ext_id; 3rd output triggers >K=2 reject at construction per §5.2 B-1 fix",
      "profile": "test_amm_profile",
      "height": 200,
      "sighash_type": 1,
      "self_input_value": 1000,
      "ext_payload_hex": "6400000000000000c800000000000000",
      "continuing_outputs": [
        {
          "value": 900,
          "ext_payload_hex": "6b00000000000000cf00000000000000",
          "note": "index 0: first continuing output — NEVER REACHES verifier; tx rejected at step 3c construction"
        },
        {
          "value": 50,
          "ext_payload_hex": "3200000000000000c800000000000000",
          "note": "index 1: second continuing output — NEVER REACHES verifier; tx rejected at step 3c construction"
        },
        {
          "value": 10,
          "ext_payload_hex": "0100000000000000",
          "note": "index 2: TRIGGERS TX_ERR_COVENANT_TYPE_INVALID at step 3c (3rd qualifying output, ContinuingOutputCount==K=2)"
        },
        {
          "value": 10,
          "ext_payload_hex": "0200000000000000",
          "note": "index 3: never evaluated; tx already rejected at index 2"
        },
        {
          "value": 10,
          "ext_payload_hex": "0300000000000000",
          "note": "index 4: never evaluated; tx already rejected at index 2"
        }
      ],
      "expect_ok": false,
      "expect_err": "TX_ERR_COVENANT_TYPE_INVALID",
      "note": "Under B-1 fix: when ContinuingOutputCount==K and another qualifying output is found, immediate TX_ERR_COVENANT_TYPE_INVALID. Silent truncation (v1 behaviour) is prohibited."
    },
    {
      "id": "CV-TXCTX-05",
      "description": "All outputs have ext_id=0x0FFE; excluded from ContinuingOutputs for 0x0FFF; AMM requires Count>=1",
      "profile": "test_amm_profile",
      "height": 200,
      "sighash_type": 1,
      "self_input_value": 1000,
      "ext_payload_hex": "6400000000000000c800000000000000",
      "continuing_outputs": [
        {
          "value": 900,
          "ext_id": "0x0FFE",
          "ext_payload_hex": "0100000000000000"
        }
      ],
      "expect_ok": false,
      "expect_err": "TX_ERR_SIG_INVALID",
      "continuing_ext_id_override": "0x0FFE"
    },
    {
      "id": "CV-TXCTX-06",
      "description": "Only non-CORE_EXT outputs (CORE_P2PK); excluded from ContinuingOutputs; AMM requires Count>=1",
      "profile": "test_amm_profile",
      "height": 200,
      "sighash_type": 1,
      "self_input_value": 1000,
      "ext_payload_hex": "6400000000000000c800000000000000",
      "output_covenant_types": [
        "CORE_P2PK"
      ],
      "continuing_outputs": [],
      "expect_ok": false,
      "expect_err": "TX_ERR_SIG_INVALID"
    },
    {
      "id": "CV-TXCTX-07",
      "description": "sighash_type=0x02 (SIGHASH_NONE); allowed_sighash_set=0x01 disallows it; sub-step 7.1",
      "profile": "test_amm_profile",
      "height": 200,
      "sighash_type": 2,
      "self_input_value": 1000,
      "ext_payload_hex": "6400000000000000c800000000000000",
      "continuing_outputs": [
        {
          "value": 950,
          "ext_payload_hex": "6b00000000000000cf00000000000000"
        }
      ],
      "expect_ok": false,
      "expect_err": "TX_ERR_SIG_ALG_INVALID"
    },
    {
      "id": "CV-TXCTX-08",
      "description": "TxContextBase totals consistent; self_input_value matches UTXO value; AMM satisfied",
      "profile": "test_amm_profile",
      "height": 200,
      "sighash_type": 1,
      "self_input_value": 1000,
      "utxo_value": 1000,
      "total_in": 1000,
      "total_out": 1000,
      "ext_payload_hex": "6400000000000000c800000000000000",
      "continuing_outputs": [
        {
          "value": 950,
          "ext_payload_hex": "6b00000000000000cf00000000000000"
        }
      ],
      "expect_ok": true
    },
    {
      "id": "CV-TXCTX-09",
      "description": "ValidateOutputAtCreation (step 2) rejects transaction; TxContext not built",
      "profile": "test_amm_profile",
      "height": 200,
      "sighash_type": 1,
      "self_input_value": 1000,
      "ext_payload_hex": "6400000000000000c800000000000000",
      "inject_step2_error": "TX_ERR_COVENANT_TYPE_INVALID",
      "expect_ok": false,
      "expect_err": "TX_ERR_COVENANT_TYPE_INVALID",
      "note": "TxContext construction never reached"
    },
    {
      "id": "CV-TXCTX-10",
      "description": "Two CORE_EXT inputs same ext_id=0x0FFF; identical TxContextBase and TxContextContinuing; different self_input_value; both AMM satisfied",
      "multi_input": true,
      "inputs": [
        {
          "profile": "test_amm_profile",
          "height": 200,
          "sighash_type": 1,
          "self_input_value": 600,
          "utxo_value": 600,
          "ext_payload_hex": "6400000000000000c800000000000000"
        },
        {
          "profile": "test_amm_profile",
          "height": 200,
          "sighash_type": 1,
          "self_input_value": 400,
          "utxo_value": 400,
          "ext_payload_hex": "6400000000000000c800000000000000"
        }
      ],
      "continuing_outputs": [
        {
          "value": 950,
          "ext_payload_hex": "6b00000000000000cf00000000000000"
        }
      ],
      "assertion": "ctx_base pointer identical for both invocations; ctx_continuing pointer identical for both invocations; input[0] MUST receive self_input_value=600 (NOT shared ctx value); input[1] MUST receive self_input_value=400 (NOT shared ctx value). Harness MUST verify each invocation receives its own distinct self_input_value from the per-input witness, not a cached or shared value.",
      "expect_ok": true,